{
  "meta": {
    "schemaVersion": "1.0",
    "title": "200 行手撕 GPT",
    "voiceRef": "/home/ubuntu/AutoVideo/tests/__compile_output__/microgpt-e2e/B00.wav",
    "aspect": "16:9",
    "width": 1920,
    "height": 1080,
    "fps": 30,
    "theme": "dark-code",
    "subtitleSafeBottom": 162
  },
  "blocks": [
    {
      "id": "B01",
      "title": "GPT 是什么",
      "enter": "fade-up",
      "exit": "fade",
      "visual": {
        "description": "屏幕中央显示大标题 \"GPT = 下一个词预测器\"，白色大字，渐显\n\n--- narration ---\nGPT 本质上就是一个下一个词预测器\n给它一串文字，它告诉你下一个最可能的词"
      },
      "narration": {
        "lines": [
          {
            "text": "GPT 本质上就是一个下一个词预测器",
            "ttsText": "GPT 本质上就是一个下一个词预测器",
            "highlights": []
          },
          {
            "text": "给它一串文字，它告诉你下一个最可能的词",
            "ttsText": "给它一串文字，它告诉你下一个最可能的词",
            "highlights": []
          }
        ],
        "explicitDurationSec": 8
      }
    },
    {
      "id": "B02",
      "title": "下一个词预测器",
      "enter": "fade-up",
      "exit": "fade",
      "visual": {
        "description": "0s: 屏幕中央显示大标题 \"GPT = ?\"，带脉冲动画\n3s: 标题变为 \"GPT = 下一个词预测器\"\n6s: 左侧文本框显示 \"今天天气真\"，右侧概率条形图\n8s: \"好\" 弹出飞入文本末尾变成 \"今天天气真好\"\n\n--- narration ---\n我们有 \"今天天气真\" 这几个字的输入\n然后我们要预测下一个字\n按概率选最高的字拼上去"
      },
      "narration": {
        "lines": [
          {
            "text": "我们有 \"今天天气真\" 这几个字的输入",
            "ttsText": "我们有 \"今天天气真\" 这几个字的输入",
            "highlights": []
          },
          {
            "text": "然后我们要预测下一个字",
            "ttsText": "然后我们要预测下一个字",
            "highlights": []
          },
          {
            "text": "按概率选最高的字拼上去",
            "ttsText": "按概率选最高的字拼上去",
            "highlights": []
          }
        ]
      }
    }
  ],
  "assets": {},
  "artifacts": {
    "compiledAt": "2026-05-01T05:41:39.004Z"
  }
}