{
  "meta": {
    "schemaVersion": "1.0",
    "title": "Highlight Test",
    "voiceRef": "/home/ubuntu/AutoVideo/tests/__compile_output__/highlight-test/B00.wav",
    "aspect": "16:9",
    "width": 1920,
    "height": 1080,
    "fps": 30,
    "theme": "dark-code",
    "subtitleSafeBottom": 162
  },
  "blocks": [
    {
      "id": "B01",
      "title": "Test Block",
      "enter": "fade",
      "exit": "fade",
      "visual": {
        "description": "Simple text display\n\n--- narration ---\n这是**重要**的概念\n另一个\\*\\*字面量"
      },
      "narration": {
        "lines": [
          {
            "text": "这是**重要**的概念",
            "ttsText": "这是重要的概念",
            "highlights": [
              {
                "start": 2,
                "end": 4
              }
            ]
          },
          {
            "text": "另一个\\*\\*字面量",
            "ttsText": "另一个**字面量",
            "highlights": []
          }
        ]
      }
    }
  ],
  "assets": {},
  "artifacts": {
    "compiledAt": "2026-05-01T05:41:38.993Z"
  }
}