{
  "meta": {
    "schemaVersion": "1.0",
    "title": "Test Video",
    "voiceRef": "/home/ubuntu/AutoVideo/tests/fixtures/compile-test/B00.wav",
    "aspect": "16:9",
    "width": 1920,
    "height": 1080,
    "fps": 30,
    "theme": "dark-code",
    "subtitleSafeBottom": 162
  },
  "blocks": [
    {
      "id": "B01",
      "title": "Introduction",
      "enter": "fade-up",
      "exit": "fade",
      "visual": {
        "description": "屏幕中央显示大标题 \"Hello World\"，白色大字，渐显\n\n--- narration ---\n这是一个测试视频的介绍\n欢迎来到 AutoVideo 的世界"
      },
      "narration": {
        "lines": [
          {
            "text": "这是一个测试视频的介绍",
            "ttsText": "这是一个测试视频的介绍",
            "highlights": []
          },
          {
            "text": "欢迎来到 AutoVideo 的世界",
            "ttsText": "欢迎来到 AutoVideo 的世界",
            "highlights": []
          }
        ],
        "explicitDurationSec": 8
      },
      "audio": {
        "wavPath": "public/audio/B01.wav",
        "durationSec": 5.0,
        "lineTimings": [
          {
            "lineIndex": 0,
            "startMs": 0,
            "endMs": 2000
          },
          {
            "lineIndex": 1,
            "startMs": 2200,
            "endMs": 4200
          }
        ]
      },
      "timing": {
        "enterSec": 0.5,
        "holdSec": 5.0,
        "exitSec": 0.3,
        "totalSec": 5.8,
        "frames": 174,
        "enterFrames": 15
      }
    },
    {
      "id": "B02",
      "title": "Architecture",
      "enter": "slide-left",
      "exit": "zoom-out",
      "visual": {
        "description": "显示图片 assets/90c144a4.png，居中展示，清晰可读\n\n--- narration ---\n整体架构分为三层\n从下到上依次是输入层、处理层、输出层"
      },
      "narration": {
        "lines": [
          {
            "text": "整体架构分为三层",
            "ttsText": "整体架构分为三层",
            "highlights": []
          },
          {
            "text": "从下到上依次是输入层、处理层、输出层",
            "ttsText": "从下到上依次是输入层、处理层、输出层",
            "highlights": []
          }
        ]
      },
      "audio": {
        "wavPath": "public/audio/B02.wav",
        "durationSec": 4.0,
        "lineTimings": [
          {
            "lineIndex": 0,
            "startMs": 0,
            "endMs": 1800
          },
          {
            "lineIndex": 1,
            "startMs": 2000,
            "endMs": 4000
          }
        ]
      },
      "timing": {
        "enterSec": 0.5,
        "holdSec": 4.0,
        "exitSec": 0.3,
        "totalSec": 4.8,
        "frames": 144,
        "enterFrames": 15
      }
    }
  ],
  "assets": {
    "assets/diagram.png": "assets/90c144a4.png"
  },
  "artifacts": {
    "compiledAt": "2026-05-01T05:41:39.002Z"
  }
}